{
  "$schema": "https://json-schema.org/draft/2020-12/schema",
  "$id": "https://exhibitos.github.io/spec/oes/v1/1.0.0-draft.1/exhibition.schema.json",
  "title": "OES Exhibition 1.0.0-draft.1",
  "type": "object",
  "additionalProperties": false,
  "properties": {
    "schemaVersion": {
      "const": "1.0.0-draft.1"
    },
    "kind": {
      "const": "exhibition-revision"
    },
    "id": {
      "type": "string",
      "format": "uuid"
    },
    "revisionId": {
      "type": "string",
      "format": "uuid"
    },
    "revision": {
      "type": "integer",
      "minimum": 1
    },
    "createdAt": {
      "type": "string",
      "format": "date-time",
      "pattern": "^\\d{4}-\\d{2}-\\d{2}T\\d{2}:\\d{2}:[0-5]\\d(?:\\.\\d{1,3})?Z$"
    },
    "title": {
      "type": "string",
      "minLength": 1,
      "maxLength": 512
    },
    "units": {
      "const": "meter"
    },
    "coordinates": {
      "const": "right-handed-y-up"
    },
    "rooms": {
      "type": "array",
      "items": {
        "$ref": "#/$defs/room"
      },
      "minItems": 1,
      "maxItems": 128
    },
    "surfaces": {
      "type": "array",
      "items": {
        "$ref": "#/$defs/surface"
      },
      "minItems": 0,
      "maxItems": 2048
    },
    "openings": {
      "type": "array",
      "items": {
        "$ref": "#/$defs/opening"
      },
      "minItems": 0,
      "maxItems": 1024
    },
    "artworks": {
      "type": "array",
      "items": {
        "$ref": "https://exhibitos.github.io/spec/oes/v1/1.0.0-draft.1/artwork.schema.json"
      },
      "minItems": 0,
      "maxItems": 1024
    },
    "placements": {
      "type": "array",
      "items": {
        "$ref": "#/$defs/placement"
      },
      "minItems": 0,
      "maxItems": 4096
    },
    "lights": {
      "type": "array",
      "items": {
        "$ref": "#/$defs/light"
      },
      "minItems": 0,
      "maxItems": 1024
    },
    "navigation": {
      "type": "array",
      "items": {
        "$ref": "#/$defs/navigation"
      },
      "minItems": 0,
      "maxItems": 128
    },
    "accessibility": {
      "$ref": "#/$defs/accessibility"
    },
    "mediaAssets": {
      "type": "array",
      "items": {
        "$ref": "#/$defs/mediaAsset"
      },
      "minItems": 0,
      "maxItems": 128
    },
    "audioZones": {
      "type": "array",
      "items": {
        "$ref": "#/$defs/audioZone"
      },
      "minItems": 0,
      "maxItems": 128
    },
    "annotations": {
      "type": "array",
      "items": {
        "$ref": "#/$defs/annotation"
      },
      "minItems": 0,
      "maxItems": 4096
    },
    "scripts": {
      "type": "array",
      "items": {
        "$ref": "#/$defs/script"
      },
      "minItems": 0,
      "maxItems": 128
    },
    "extensions": {
      "type": "object",
      "maxProperties": 32,
      "propertyNames": {
        "pattern": "^[a-z][a-z0-9-]*(?:\\.[a-z][a-z0-9-]*)+\\/[A-Za-z0-9_-]+$"
      },
      "additionalProperties": {
        "type": "object"
      }
    }
  },
  "required": [
    "schemaVersion",
    "kind",
    "id",
    "revisionId",
    "revision",
    "createdAt",
    "title",
    "units",
    "coordinates",
    "rooms",
    "surfaces",
    "openings",
    "artworks",
    "placements",
    "lights",
    "navigation",
    "accessibility",
    "mediaAssets",
    "audioZones",
    "annotations",
    "scripts"
  ],
  "$defs": {
    "room": {
      "type": "object",
      "additionalProperties": false,
      "properties": {
        "id": {
          "type": "string",
          "format": "uuid"
        },
        "name": {
          "type": "string",
          "minLength": 1,
          "maxLength": 512
        },
        "dimensions": {
          "type": "object",
          "additionalProperties": false,
          "properties": {
            "width": {
              "type": "number",
              "exclusiveMinimum": 0
            },
            "height": {
              "type": "number",
              "exclusiveMinimum": 0
            },
            "depth": {
              "type": "number",
              "exclusiveMinimum": 0
            }
          },
          "required": [
            "width",
            "height",
            "depth"
          ]
        },
        "transform": {
          "$ref": "https://exhibitos.github.io/spec/oes/v1/1.0.0-draft.1/artwork.schema.json#/$defs/transform"
        }
      },
      "required": [
        "id",
        "name",
        "dimensions",
        "transform"
      ]
    },
    "surface": {
      "type": "object",
      "additionalProperties": false,
      "properties": {
        "id": {
          "type": "string",
          "format": "uuid"
        },
        "roomId": {
          "type": "string",
          "format": "uuid"
        },
        "type": {
          "enum": [
            "wall",
            "floor",
            "ceiling"
          ]
        },
        "transform": {
          "$ref": "https://exhibitos.github.io/spec/oes/v1/1.0.0-draft.1/artwork.schema.json#/$defs/transform"
        },
        "dimensions": {
          "type": "object",
          "additionalProperties": false,
          "properties": {
            "width": {
              "type": "number",
              "exclusiveMinimum": 0
            },
            "height": {
              "type": "number",
              "exclusiveMinimum": 0
            }
          },
          "required": [
            "width",
            "height"
          ]
        }
      },
      "required": [
        "id",
        "roomId",
        "type",
        "transform",
        "dimensions"
      ]
    },
    "opening": {
      "type": "object",
      "additionalProperties": false,
      "properties": {
        "id": {
          "type": "string",
          "format": "uuid"
        },
        "surfaceId": {
          "type": "string",
          "format": "uuid"
        },
        "type": {
          "enum": [
            "door",
            "window"
          ]
        },
        "offset": {
          "type": "array",
          "items": {
            "type": "number"
          },
          "minItems": 2,
          "maxItems": 2
        },
        "dimensions": {
          "type": "object",
          "additionalProperties": false,
          "properties": {
            "width": {
              "type": "number",
              "exclusiveMinimum": 0
            },
            "height": {
              "type": "number",
              "exclusiveMinimum": 0
            }
          },
          "required": [
            "width",
            "height"
          ]
        },
        "connectsToOpeningId": {
          "type": "string",
          "format": "uuid"
        },
        "exterior": {
          "type": "boolean"
        }
      },
      "required": [
        "id",
        "surfaceId",
        "type",
        "offset",
        "dimensions"
      ]
    },
    "placement": {
      "type": "object",
      "additionalProperties": false,
      "properties": {
        "id": {
          "type": "string",
          "format": "uuid"
        },
        "roomId": {
          "type": "string",
          "format": "uuid"
        },
        "artworkRevisionId": {
          "type": "string",
          "format": "uuid"
        },
        "assetId": {
          "type": "string",
          "format": "uuid"
        },
        "transform": {
          "$ref": "https://exhibitos.github.io/spec/oes/v1/1.0.0-draft.1/artwork.schema.json#/$defs/transform"
        }
      },
      "required": [
        "id",
        "roomId",
        "artworkRevisionId",
        "assetId",
        "transform"
      ]
    },
    "light": {
      "type": "object",
      "additionalProperties": false,
      "properties": {
        "id": {
          "type": "string",
          "format": "uuid"
        },
        "roomId": {
          "type": "string",
          "format": "uuid"
        },
        "type": {
          "enum": [
            "point",
            "spot",
            "directional",
            "area"
          ]
        },
        "transform": {
          "$ref": "https://exhibitos.github.io/spec/oes/v1/1.0.0-draft.1/artwork.schema.json#/$defs/transform"
        },
        "color": {
          "type": "array",
          "items": {
            "type": "number",
            "minimum": 0,
            "maximum": 1
          },
          "minItems": 3,
          "maxItems": 3
        },
        "intensity": {
          "type": "number",
          "minimum": 0
        },
        "unit": {
          "enum": [
            "candela",
            "lux",
            "lumen"
          ]
        },
        "castsShadow": {
          "type": "boolean"
        },
        "beamAngle": {
          "type": "number",
          "exclusiveMinimum": 0,
          "maximum": 1.5707963267948966
        },
        "dimensions": {
          "type": "object",
          "additionalProperties": false,
          "properties": {
            "width": {
              "type": "number",
              "exclusiveMinimum": 0
            },
            "height": {
              "type": "number",
              "exclusiveMinimum": 0
            }
          },
          "required": [
            "width",
            "height"
          ]
        },
        "targetPlacementId": {
          "type": "string",
          "format": "uuid"
        }
      },
      "required": [
        "id",
        "roomId",
        "type",
        "transform",
        "color",
        "intensity",
        "unit",
        "castsShadow"
      ]
    },
    "navigation": {
      "type": "object",
      "additionalProperties": false,
      "properties": {
        "id": {
          "type": "string",
          "format": "uuid"
        },
        "name": {
          "type": "string",
          "minLength": 1,
          "maxLength": 256
        },
        "accessible": {
          "type": "boolean"
        },
        "waypoints": {
          "type": "array",
          "items": {
            "type": "object",
            "additionalProperties": false,
            "properties": {
              "roomId": {
                "type": "string",
                "format": "uuid"
              },
              "position": {
                "type": "array",
                "items": {
                  "type": "number"
                },
                "minItems": 3,
                "maxItems": 3
              },
              "viaOpeningId": {
                "type": "string",
                "format": "uuid"
              }
            },
            "required": [
              "roomId",
              "position"
            ]
          },
          "minItems": 1,
          "maxItems": 4096
        }
      },
      "required": [
        "id",
        "name",
        "accessible",
        "waypoints"
      ]
    },
    "accessibility": {
      "type": "object",
      "additionalProperties": false,
      "properties": {
        "alternativeView": {
          "const": "list"
        },
        "keyboardNavigation": {
          "const": true
        },
        "reducedMotion": {
          "const": true
        },
        "stationaryNavigation": {
          "const": true
        },
        "routeIds": {
          "type": "array",
          "items": {
            "type": "string",
            "format": "uuid"
          },
          "minItems": 0,
          "maxItems": 128
        },
        "artworkDescriptions": {
          "type": "array",
          "items": {
            "type": "object",
            "additionalProperties": false,
            "properties": {
              "placementId": {
                "type": "string",
                "format": "uuid"
              },
              "text": {
                "type": "string",
                "minLength": 1,
                "maxLength": 8192
              }
            },
            "required": [
              "placementId",
              "text"
            ]
          },
          "minItems": 0,
          "maxItems": 4096
        }
      },
      "required": [
        "alternativeView",
        "keyboardNavigation",
        "reducedMotion",
        "stationaryNavigation",
        "routeIds",
        "artworkDescriptions"
      ]
    },
    "mediaAsset": {
      "type": "object",
      "additionalProperties": false,
      "properties": {
        "id": {
          "type": "string",
          "format": "uuid"
        },
        "path": {
          "type": "string",
          "maxLength": 240,
          "pattern": "^(?:[A-Za-z0-9_-][A-Za-z0-9_.-]*/)*[A-Za-z0-9_-][A-Za-z0-9_.-]*$"
        },
        "mime": {
          "enum": [
            "audio/mpeg",
            "audio/ogg",
            "audio/wav"
          ]
        },
        "bytes": {
          "type": "integer",
          "minimum": 1,
          "maximum": 104857600
        },
        "sha256": {
          "type": "string",
          "pattern": "^[0-9a-f]{64}$"
        },
        "rights": {
          "$ref": "https://exhibitos.github.io/spec/oes/v1/1.0.0-draft.1/artwork.schema.json#/$defs/rights"
        }
      },
      "required": [
        "id",
        "path",
        "mime",
        "bytes",
        "sha256",
        "rights"
      ]
    },
    "audioZone": {
      "type": "object",
      "additionalProperties": false,
      "properties": {
        "id": {
          "type": "string",
          "format": "uuid"
        },
        "roomId": {
          "type": "string",
          "format": "uuid"
        },
        "assetId": {
          "type": "string",
          "format": "uuid"
        },
        "position": {
          "type": "array",
          "items": {
            "type": "number"
          },
          "minItems": 3,
          "maxItems": 3
        },
        "radius": {
          "type": "number",
          "exclusiveMinimum": 0
        },
        "volume": {
          "type": "number",
          "minimum": 0,
          "maximum": 1
        },
        "autoplay": {
          "const": false
        },
        "transcript": {
          "type": "string",
          "minLength": 1,
          "maxLength": 16384
        }
      },
      "required": [
        "id",
        "roomId",
        "assetId",
        "position",
        "radius",
        "volume",
        "autoplay",
        "transcript"
      ]
    },
    "annotation": {
      "type": "object",
      "additionalProperties": false,
      "properties": {
        "id": {
          "type": "string",
          "format": "uuid"
        },
        "placementId": {
          "type": "string",
          "format": "uuid"
        },
        "text": {
          "type": "string",
          "minLength": 1,
          "maxLength": 16384
        }
      },
      "required": [
        "id",
        "placementId",
        "text"
      ]
    },
    "script": {
      "type": "object",
      "additionalProperties": false,
      "properties": {
        "id": {
          "type": "string",
          "format": "uuid"
        },
        "enabled": {
          "const": false
        },
        "trigger": {
          "type": "object",
          "additionalProperties": false,
          "properties": {
            "type": {
              "enum": [
                "exhibition-start",
                "room-enter"
              ]
            },
            "roomId": {
              "type": "string",
              "format": "uuid"
            }
          },
          "required": [
            "type"
          ]
        },
        "actions": {
          "type": "array",
          "items": {
            "type": "object",
            "additionalProperties": false,
            "properties": {
              "type": {
                "enum": [
                  "set-light-intensity",
                  "show-annotation",
                  "play-audio"
                ]
              },
              "targetId": {
                "type": "string",
                "format": "uuid"
              },
              "delayMs": {
                "type": "integer",
                "minimum": 0,
                "maximum": 60000
              },
              "value": {
                "type": "number",
                "minimum": 0
              }
            },
            "required": [
              "type",
              "targetId",
              "delayMs"
            ]
          },
          "minItems": 1,
          "maxItems": 32
        }
      },
      "required": [
        "id",
        "enabled",
        "trigger",
        "actions"
      ]
    }
  }
}
