{
  "schemaVersion": "1.0.0-draft.1",
  "kind": "exhibition-revision",
  "id": "50000000-0000-4000-8000-000000000001",
  "revisionId": "50000000-0000-4000-8000-000000000002",
  "revision": 1,
  "createdAt": "2026-10-01T00:00:00Z",
  "title": "Synthetic contract reference exhibition",
  "units": "meter",
  "coordinates": "right-handed-y-up",
  "rooms": [
    {
      "id": "50000000-0000-4000-8000-000000000010",
      "name": "Synthetic white cube",
      "dimensions": {
        "width": 12,
        "height": 4,
        "depth": 8
      },
      "transform": {
        "position": [
          0,
          0,
          0
        ],
        "rotation": [
          0,
          0,
          0,
          1
        ],
        "scale": [
          1,
          1,
          1
        ]
      }
    }
  ],
  "surfaces": [
    {
      "id": "50000000-0000-4000-8000-000000000020",
      "roomId": "50000000-0000-4000-8000-000000000010",
      "type": "wall",
      "dimensions": {
        "width": 12,
        "height": 4
      },
      "transform": {
        "position": [
          0,
          2,
          -4
        ],
        "rotation": [
          0,
          0,
          0,
          1
        ],
        "scale": [
          1,
          1,
          1
        ]
      }
    }
  ],
  "openings": [
    {
      "id": "50000000-0000-4000-8000-000000000030",
      "surfaceId": "50000000-0000-4000-8000-000000000020",
      "type": "door",
      "offset": [
        -4,
        -0.75
      ],
      "dimensions": {
        "width": 1,
        "height": 2.5
      },
      "exterior": true
    }
  ],
  "artworks": [
    {
      "schemaVersion": "1.0.0-draft.1",
      "kind": "artwork",
      "id": "10000000-0000-4000-8000-000000000001",
      "revisionId": "30000000-0000-4000-8000-000000000001",
      "revision": 1,
      "createdAt": "2026-10-01T00:00:00Z",
      "metadata": {
        "title": "Synthetic meter cube",
        "artist": "ExhibitOS contributors",
        "description": "Original fixture; no private artwork or Capture input.",
        "medium": "synthetic geometry",
        "language": "en"
      },
      "artworkType": "sculpture",
      "units": "meter",
      "coordinates": "right-handed-y-up",
      "dimensions": {
        "width": 1,
        "height": 1,
        "depth": 1
      },
      "transform": {
        "position": [
          0,
          0,
          0
        ],
        "rotation": [
          0,
          0,
          0,
          1
        ],
        "scale": [
          1,
          1,
          1
        ]
      },
      "primaryAssetId": "20000000-0000-4000-8000-000000000001",
      "assets": [
        {
          "id": "20000000-0000-4000-8000-000000000001",
          "path": "sculpture.glb",
          "role": "model",
          "mime": "model/gltf-binary",
          "bytes": 1516,
          "sha256": "1e4e53565fdbc5a71b1aaa83d6b25df6e8025add2f08b35fdca20475fbbca460"
        }
      ],
      "rights": {
        "holder": "ExhibitOS contributors",
        "ownership": "owner",
        "licenseId": "CC0-1.0",
        "permissions": {
          "display": true,
          "download": true,
          "export": true,
          "commercial": true
        },
        "creditLine": "ExhibitOS original synthetic fixtures (optional credit)"
      },
      "provenance": {
        "events": [
          {
            "id": "40000000-0000-4000-8000-000000000001",
            "type": "created",
            "at": "2026-10-01T00:00:00Z",
            "description": "Deterministically generated original fixture with baked meter geometry.",
            "tool": {
              "name": "ExhibitOS synthetic generator",
              "version": "1"
            }
          }
        ],
        "authorship": "synthetic"
      }
    },
    {
      "schemaVersion": "1.0.0-draft.1",
      "kind": "artwork",
      "id": "10000000-0000-4000-8000-000000000002",
      "revisionId": "30000000-0000-4000-8000-000000000002",
      "revision": 1,
      "createdAt": "2026-10-01T00:00:00Z",
      "metadata": {
        "title": "Synthetic color grid",
        "artist": "ExhibitOS contributors",
        "description": "Original fixture; no private artwork or Capture input.",
        "medium": "synthetic color grid",
        "language": "en"
      },
      "artworkType": "image",
      "units": "meter",
      "coordinates": "right-handed-y-up",
      "dimensions": {
        "width": 1,
        "height": 1
      },
      "transform": {
        "position": [
          0,
          0,
          0
        ],
        "rotation": [
          0,
          0,
          0,
          1
        ],
        "scale": [
          1,
          1,
          1
        ]
      },
      "primaryAssetId": "20000000-0000-4000-8000-000000000002",
      "assets": [
        {
          "id": "20000000-0000-4000-8000-000000000002",
          "path": "painting.png",
          "role": "image",
          "mime": "image/png",
          "bytes": 196960,
          "sha256": "33035fadc694f8a64d89d07425a2ed0babb9352208cf34aab657ed5922a55fe9"
        }
      ],
      "rights": {
        "holder": "ExhibitOS contributors",
        "ownership": "owner",
        "licenseId": "CC0-1.0",
        "permissions": {
          "display": true,
          "download": true,
          "export": true,
          "commercial": true
        },
        "creditLine": "ExhibitOS original synthetic fixtures (optional credit)"
      },
      "provenance": {
        "events": [
          {
            "id": "40000000-0000-4000-8000-000000000002",
            "type": "created",
            "at": "2026-10-01T00:00:00Z",
            "description": "Deterministically generated original fixture with baked meter geometry.",
            "tool": {
              "name": "ExhibitOS synthetic generator",
              "version": "1"
            }
          }
        ],
        "authorship": "synthetic"
      }
    }
  ],
  "placements": [
    {
      "id": "50000000-0000-4000-8000-000000000040",
      "roomId": "50000000-0000-4000-8000-000000000010",
      "artworkRevisionId": "30000000-0000-4000-8000-000000000001",
      "assetId": "20000000-0000-4000-8000-000000000001",
      "transform": {
        "position": [
          -2,
          0,
          0
        ],
        "rotation": [
          0,
          0,
          0,
          1
        ],
        "scale": [
          1,
          1,
          1
        ]
      }
    },
    {
      "id": "50000000-0000-4000-8000-000000000041",
      "roomId": "50000000-0000-4000-8000-000000000010",
      "artworkRevisionId": "30000000-0000-4000-8000-000000000001",
      "assetId": "20000000-0000-4000-8000-000000000001",
      "transform": {
        "position": [
          2,
          0,
          0
        ],
        "rotation": [
          0,
          0,
          0,
          1
        ],
        "scale": [
          1,
          1,
          1
        ]
      }
    },
    {
      "id": "50000000-0000-4000-8000-000000000042",
      "roomId": "50000000-0000-4000-8000-000000000010",
      "artworkRevisionId": "30000000-0000-4000-8000-000000000002",
      "assetId": "20000000-0000-4000-8000-000000000002",
      "transform": {
        "position": [
          0,
          1.5,
          -3.99
        ],
        "rotation": [
          0,
          0,
          0,
          1
        ],
        "scale": [
          1,
          1,
          1
        ]
      }
    }
  ],
  "lights": [
    {
      "id": "50000000-0000-4000-8000-000000000050",
      "roomId": "50000000-0000-4000-8000-000000000010",
      "type": "point",
      "transform": {
        "position": [
          -3,
          3,
          -2
        ],
        "rotation": [
          0,
          0,
          0,
          1
        ],
        "scale": [
          1,
          1,
          1
        ]
      },
      "color": [
        1,
        1,
        1
      ],
      "intensity": 100,
      "unit": "candela",
      "castsShadow": false
    },
    {
      "id": "50000000-0000-4000-8000-000000000051",
      "roomId": "50000000-0000-4000-8000-000000000010",
      "type": "point",
      "transform": {
        "position": [
          3,
          3,
          -2
        ],
        "rotation": [
          0,
          0,
          0,
          1
        ],
        "scale": [
          1,
          1,
          1
        ]
      },
      "color": [
        1,
        1,
        1
      ],
      "intensity": 100,
      "unit": "candela",
      "castsShadow": false
    },
    {
      "id": "50000000-0000-4000-8000-000000000052",
      "roomId": "50000000-0000-4000-8000-000000000010",
      "type": "point",
      "transform": {
        "position": [
          -3,
          3,
          2
        ],
        "rotation": [
          0,
          0,
          0,
          1
        ],
        "scale": [
          1,
          1,
          1
        ]
      },
      "color": [
        1,
        1,
        1
      ],
      "intensity": 100,
      "unit": "candela",
      "castsShadow": false
    },
    {
      "id": "50000000-0000-4000-8000-000000000053",
      "roomId": "50000000-0000-4000-8000-000000000010",
      "type": "point",
      "transform": {
        "position": [
          3,
          3,
          2
        ],
        "rotation": [
          0,
          0,
          0,
          1
        ],
        "scale": [
          1,
          1,
          1
        ]
      },
      "color": [
        1,
        1,
        1
      ],
      "intensity": 100,
      "unit": "candela",
      "castsShadow": false
    }
  ],
  "navigation": [
    {
      "id": "50000000-0000-4000-8000-000000000060",
      "name": "Stationary reference route",
      "accessible": true,
      "waypoints": [
        {
          "roomId": "50000000-0000-4000-8000-000000000010",
          "position": [
            0,
            1.6,
            2
          ]
        },
        {
          "roomId": "50000000-0000-4000-8000-000000000010",